project_name,budget,actual_cost,committed_cost,labor_cost,material_cost,subcontract_cost,overhead_cost
Trinity Commerce Center,46000000,26500000,35000000,9400000,7600000,6400000,3100000
Lakeview Towers Phase II,31500000,8400000,14000000,2950000,2300000,2050000,1100000
Bayou Connector Bridge Upgrade,66500000,30000000,45500000,10800000,9300000,6600000,3300000
Front Range Innovation District,53500000,1900000,9800000,650000,520000,420000,310000
Sonoran Battery Manufacturing Plant,60000000,62800000,62800000,22000000,18800000,14500000,7500000
Puget Sound Medical Pavilion,39000000,28200000,34000000,9800000,8100000,6900000,3400000
