project_name,project_type,status,city,start_date,end_date,contract_value,percent_complete
Trinity Commerce Center,Commercial,Active,Dallas,2024-06-15,2026-11-30,45000000,58
Lakeview Towers Phase II,Residential,Active,Austin,2025-01-20,2027-03-15,32000000,27
Bayou Connector Bridge Upgrade,Infrastructure,On Hold,Houston,2024-03-01,2026-08-31,67000000,41
Front Range Innovation District,Mixed-Use,Pre-Construction,Denver,2025-09-10,2027-12-20,52000000,4
Sonoran Battery Manufacturing Plant,Industrial,Complete,Phoenix,2024-02-12,2025-10-30,61000000,100
Puget Sound Medical Pavilion,Healthcare,Active,Seattle,2024-09-05,2026-12-31,38500000,73
